{
  "$schema": "https://json-schema.org/draft/2020-12/schema",
  "type": "object",
  "properties": {
    "id": {
      "type": "integer"
    },
    "parentId": {
      "type": [
        "integer",
        "null"
      ]
    },
    "name": {
      "type": "string"
    },
    "description": {
      "type": "string"
    },
    "path": {
      "type": "array",
      "items": {
        "type": "string"
      }
    },
    "opensPageId": {
      "type": [
        "integer",
        "null"
      ]
    },
    "forwardUrl": {
      "type": [
        "string",
        "null"
      ]
    },
    "opens": {
      "type": "object",
      "properties": {
        "kind": {
          "type": "string"
        },
        "pageId": {
          "type": [
            "integer",
            "null"
          ]
        },
        "slug": {
          "type": [
            "string",
            "null"
          ]
        },
        "url": {
          "type": [
            "string",
            "null"
          ]
        }
      },
      "additionalProperties": false
    },
    "opensSource": {
      "type": "string"
    },
    "location": {
      "type": [
        "object",
        "null"
      ],
      "properties": {
        "lat": {
          "type": "number"
        },
        "lng": {
          "type": "number"
        },
        "accuracyM": {
          "type": [
            "number",
            "null"
          ]
        },
        "source": {
          "type": "string"
        },
        "pinnedBy": {
          "type": "string"
        },
        "pinnedAt": {
          "type": "string",
          "format": "date-time"
        }
      },
      "additionalProperties": false
    },
    "pin": {
      "type": [
        "object",
        "null"
      ],
      "properties": {
        "lat": {
          "type": "number"
        },
        "lng": {
          "type": "number"
        },
        "fromPlaceId": {
          "type": "integer"
        }
      },
      "additionalProperties": false
    },
    "codes": {
      "type": "array",
      "items": {
        "type": "object",
        "properties": {
          "id": {
            "type": "integer"
          },
          "tag": {
            "type": "string"
          }
        },
        "additionalProperties": false
      }
    },
    "scans": {
      "type": "object",
      "properties": {
        "people": {
          "type": "integer"
        }
      },
      "additionalProperties": false
    },
    "createdBy": {
      "type": "string"
    },
    "createdAt": {
      "type": "string",
      "format": "date-time"
    },
    "updatedAt": {
      "type": "string",
      "format": "date-time"
    },
    "audit": {
      "type": [
        "object",
        "null"
      ],
      "properties": {
        "action": {
          "type": "string"
        },
        "by": {
          "type": "string"
        },
        "at": {
          "type": "string",
          "format": "date-time"
        }
      },
      "additionalProperties": false
    }
  },
  "additionalProperties": false
}