{"id":5,"parentId":2,"name":"West wing","description":"Wing near the food court","path":["Southgate Mall","West wing"],"opensPageId":null,"forwardUrl":null,"opens":{"kind":"page","pageId":4,"slug":"sponsors","url":null},"opensSource":"ancestor","location":{"lat":46.916,"lng":-114.039,"accuracyM":140,"source":"phone","pinnedBy":"canvasser@wmsfo.test","pinnedAt":"2026-12-20T19:00:00.000Z"},"pin":{"lat":46.916,"lng":-114.039,"fromPlaceId":5},"codes":[{"id":1,"tag":"qr-001"}],"scans":{"people":42},"createdBy":"canvasser@wmsfo.test","createdAt":"2026-12-20T18:00:00.000Z","updatedAt":"2026-12-20T19:00:00.000Z","audit":{"action":"location","by":"person:canvasser@wmsfo.test","at":"2026-12-20T19:00:00.000Z"}}